<?xml version="1.0" encoding="UTF-8"?>
<!DOCTYPE aviso SYSTEM "proba2.dtd">
<aviso>
    <titulo></titulo>

    <parrafo></parrafo>
    <parrafo></parrafo>
    <grafico></grafico>

    <parrafo></parrafo>
    <grafico></grafico>

    <parrafo></parrafo>
    <parrafo></parrafo>
    <parrafo></parrafo>
    <parrafo></parrafo>
    <parrafo></parrafo>
    <grafico></grafico>

    <parrafo></parrafo>
    <parrafo></parrafo>
    <parrafo></parrafo>
    <parrafo></parrafo>
    <parrafo></parrafo>
    <parrafo></parrafo>
    <parrafo></parrafo>
    <parrafo></parrafo>
    <parrafo></parrafo>
    <parrafo></parrafo>
    <parrafo></parrafo>
    <grafico></grafico>

    <comentario></comentario>
</aviso>